{"event_head":"sha256:80ac2e7c35fd6479742126e842a795a9c81466e411f6c268fb6e4f4540bf6180","run_id":"run-9b86a46b1f0cbcd204c70ef580a019845e3c7a6d3bcda89c7df74e38dbda7cca","schema_version":"bfworld-views-v1","views":[{"facet":"phase","id":"voltage-timeline","source":"channels.parquet","type":"line","unit":"V","x":"time_s","y":"capacitor_voltage_v"},{"filter":["constraint_violated","design_revision_applied"],"id":"failure-lens","source":"events.jsonl","type":"events"},{"id":"evidence-matrix","source":"evidence.json","type":"claims"}]}
